{
  "$schema": "http://json-schema.org/draft-07/schema#",
  "title": "repoConfig",
  "type": "object",
  "required": ["repoName", "workshopTitle", "themeVariant"],
  "additionalProperties": false,
  "allOf": [
    {
      "if": {
        "properties": { "repoName": { "enum": ["UserRepo", "CentralRepo"] } },
        "required": ["repoName"]
      },
      "then": {},
      "else": {
        "properties": {
          "workshopTitle": { "not": { "const": "Hugo for Fortinet TECWorkshops" } }
        }
      }
    }
  ],
  "properties": {
    "repoName":         { "type": "string", "minLength": 1, "pattern": "^[A-Za-z0-9._-]+$" },
    "author":           { "type": "string" },
    "workshopTitle":    { "type": "string", "minLength": 1 },
    "themeVariant": {
      "type": "string",
      "enum": ["Workshop", "Demo", "UseCase", "Spotlight", "Xperts2024", "Xperts2025",
               "CloudCSEMovie", "FortinetSilver", "FortinetTeal", "FortinetBlue"]
    },
    "logoBannerText":       { "type": "string" },
    "logoBannerSubText":    { "type": "string" },
    "errorLevel":           { "type": "string", "enum": ["warning", "error"] },
    "googleServicesID":     { "type": "string" },
    "marketingCode":        { "type": "string" },
    "analyticsBaseUrl":     { "type": "string" },
    "quizUrl":              { "type": "string" },
    "provisionApiBaseUrl":  { "type": "string" },
    "videoHeaderSrc":       { "type": "string" },
    "videoHeaderInterval":  { "type": ["string", "number"] },
    "disableInlineCopyToClipBoard": { "type": "boolean" },
    "bannerLine1":          { "type": "string" },
    "bannerLine2":          { "type": "string" },
    "bannerLine3":          { "type": "string" },
    "errorignore": {
      "type": "array",
      "items": { "type": "string", "minLength": 1 }
    },
    "deploymentPaths": {
      "type": "array",
      "items": {
        "type": "object",
        "required": ["key", "title"],
        "properties": {
          "key":   { "type": "string", "minLength": 1 },
          "title": { "type": "string", "minLength": 1 }
        },
        "additionalProperties": false
      }
    },
    "shortcuts": {
      "type": "array",
      "items": {
        "type": "object",
        "required": ["text", "URL"],
        "properties": {
          "text":   { "type": "string" },
          "URL":    { "type": "string" },
          "icon":   { "type": "string" },
          "weight": { "type": "number" }
        },
        "additionalProperties": false
      }
    }
  }
}
