{
  "repoName":"CentralRepo",
  "author":"Jeff Kopko",
  "workshopTitle":"CentralRepo Test Workshop",
  "themeVariant":"CloudCSEMovie",
  "logoBannerText":"Public Cloud 10x",
  "logoBannerSubText":"Workshop Title Here",
  "errorLevel":"warning",
  "googleServicesID":"G-5RZBH288ST",
  "marketingCode": "",
  "bannerLine1":"Workshop Type ID Eg: Public Cloud 101",
  "bannerLine2":"Workshop Title Here",
  "bannerLine3":"Subtitle,Description, or 3rd line Here",
  "quizUrl":"https://publiccloud105-fortiflex-o32xpkqaca-uc.a.run.app",
  "analyticsBaseUrl":"https://tecanalytics.forticloudcse.com",
  "videoHeaderSrc": "/videos/CloudsAnimated.mp4",
  "videoHeaderInterval": "60",
  "shortcuts": [
  {
    "text": "Fortinet Cloud CSE GitHub Org",
    "URL": "https://github.com/FortinetCloudCSE",
    "icon": "fa-graduation-cap",
    "weight":10
  },
  {
    "text": "Fortinet Standard Workshop Guide",
    "URL": "https://fortinetcloudcse.github.io/UserRepo",
    "icon": "fa-tools",
    "weight":20
  },
  {
    "text": "Fortinet Standard Workshop Template Repo",
    "URL": "https://github.com/FortinetCloudCSE/UserRepo",
    "icon": "fa-tools",
    "weight":30
  },
  {
    "text": "Fortinet Hugo reLearn theme - Guide",
    "URL": "https://mcshelby.github.io/hugo-theme-relearn/index.html",
    "icon": "fa-tools",
    "weight":40
  }
  ]
}